device_id,device_name,component,part_number,quantity,description
surface-laptop-5,Surface Laptop 5,Battery,M1287099-003,1,Rechargeable internal battery assembly 45Wh
surface-laptop-5,Surface Laptop 5,Display,M1234567-001,1,13.5-inch PixelSense touchscreen display assembly
surface-laptop-5,Surface Laptop 5,Keyboard,M2045678-001,1,Backlit keyboard deck with trackpad
surface-laptop-5,Surface Laptop 5,Kickstand Hinge,M3456789-002,2,Left and right hinge assembly for lid
surface-pro-9,Surface Pro 9,Kickstand,M9876543-002,1,Adjustable kickstand hinge assembly
surface-pro-9,Surface Pro 9,Type Cover Port,M8765432-001,1,Magnetic type-cover connector assembly
